{
  "$schema": "./TEMPLATE.schema.json",
  "schema_version": "1.0.0",
  "template_type": "ontology_slice",
  "slice_request": {
    "task_name": "[例如：订单风控规则建模]",
    "slice_topic": "[例如：支付风险判断]",
    "task_goal": "[例如：抽取支付风险相关实体、关系与约束，用于后续规则引擎建模]",
    "expected_output": [
      "[例如：concept_table]",
      "[例如：relation_table]",
      "[例如：constraint_list]"
    ]
  },
  "scope": {
    "include": [
      {
        "type": "concept",
        "id": "C1",
        "name": "[核心实体 1]",
        "reason": "[纳入原因]"
      },
      {
        "type": "relation",
        "id": "R1",
        "name": "[核心关系 1]",
        "reason": "[纳入原因]"
      }
    ],
    "exclude": [
      {
        "name": "[无关领域 1]",
        "reason": "[排除原因]"
      },
      {
        "name": "[历史遗留定义]",
        "reason": "[当前任务不依赖]"
      }
    ]
  },
  "sources": [
    {
      "id": "S1",
      "path": "[文件路径 / 文档名 / 配置名]",
      "source_type": "document",
      "role": "[例如：定义核心实体]",
      "priority": 1,
      "trust_level": "high"
    },
    {
      "id": "S2",
      "path": "[代码位置 / 类型定义 / 枚举]",
      "source_type": "code",
      "role": "[例如：补充命名映射]",
      "priority": 2,
      "trust_level": "medium"
    }
  ],
  "conflicts": [
    {
      "item": "[概念 / 关系 / 约束名称]",
      "source_ids": [
        "S1",
        "S2"
      ],
      "resolution": "[采用哪个定义，为什么]",
      "status": "resolved"
    }
  ],
  "summary": {
    "topic": "[主题]",
    "one_line_conclusion": "[一句话说明这次切片覆盖了什么]",
    "selection_basis": "[为什么纳入这些概念]",
    "exclusion_basis": "[为什么排除其他内容]"
  },
  "concepts": [
    {
      "id": "C1",
      "name_zh": "[概念名]",
      "name_en": "[identifier]",
      "aliases": [
        "[别名 1]",
        "[别名 2]"
      ],
      "kind": "entity",
      "definition": "[定义]",
      "parent_concept_id": null,
      "key_properties": [
        {
          "name": "[属性名]",
          "type": "string",
          "required": true,
          "description": "[属性含义]"
        }
      ],
      "source_ids": [
        "S1"
      ]
    }
  ],
  "relations": [
    {
      "id": "R1",
      "subject_concept_id": "C1",
      "predicate": "[relates_to / depends_on / contains]",
      "object_concept_id": "C2",
      "description": "[关系解释]",
      "cardinality": "n:n",
      "direction": "uni",
      "conditions": [
        "[条件 1]"
      ],
      "source_ids": [
        "S1"
      ]
    }
  ],
  "constraints": [
    {
      "id": "K1",
      "name": "[约束名]",
      "applies_to": {
        "concept_ids": [
          "C1"
        ],
        "relation_ids": [
          "R1"
        ]
      },
      "rule": "[必须满足什么]",
      "trigger": "[何时生效]",
      "forbidden": [
        "[不能怎么用]"
      ],
      "severity": "medium",
      "source_ids": [
        "S1"
      ]
    }
  ],
  "term_mappings": [
    {
      "term": "[term]",
      "candidate_concept_ids": [
        "C1",
        "C2"
      ],
      "selected_concept_id": "C1",
      "reason": "[采用该定义的原因]"
    }
  ],
  "ambiguities": [
    {
      "description": "[概念 A 不等于概念 B，区别在于什么]",
      "impact": "[会影响哪些判断]",
      "status": "open"
    }
  ],
  "uncertainties": [
    {
      "item": "[不确定项 1]",
      "missing_evidence": "[缺少什么依据]",
      "required_user_input": "[需要用户补充什么]"
    }
  ],
  "next_actions": [
    {
      "action": "[例如：基于该切片生成 JSON Schema]",
      "owner": "agent",
      "priority": "P2"
    }
  ],
  "meta": {
    "generated_at": "2026-04-20T00:00:00Z",
    "generated_by": "ontology_extraction",
    "workspace": "[当前工作区或项目名]",
    "notes": "[补充说明]"
  }
}